Question #,Question Text,Answer 1,Answer 2,Answer 3,Answer 4,Time Limit (sec),Correct Answer(s)
1,What does HTML stand for?,How To Make Links,HyperText Markup Language,Hot Tea & Milk Latte,Home Tools Mark-up Language,20,2
2,Which tag creates the biggest heading?,<h6>,<head>,<h1>,<big>,20,3
3,Which tag is used for a paragraph?,<para>,<p>,<text>,<pg>,20,2
4,How do you create a link to another website?,"<link url=""...""">","<a href=""..."">text</a>",<goto>...</goto>,<url>...</url>,30,2
5,Why should images always have an alt attribute?,It makes the image load faster,It is required by the browser to show the image,It describes the image for screen readers and if the image fails to load,It controls the image's size,30,3
